order,class_name,class_teacher,class_school,class_sum
33,新冠疫情中新闻学术数据的获取及分析应用,杜冀中 ,智谱·AI,91
33,任务导向对话的数据和平台建设,朱祺 ,清华大学,90
33,计算机视觉在地图领域的应用,滴滴-科技生态与发展部 ,滴滴,90
33,Embedded Software Design,赖晓晨 刘辉 申建建 ,大连理工大学,89
33,CVPR2020竞赛经验分享会,滴滴-科技生态与发展部 ,滴滴,80
33,AI分割技术在快手平台的应用,宋丛礼 ,清华大学,80
34,对话系统中的个性化回复生成与异常输入检测,郑银河 ,清华大学,77
34,铸钢件铸造技术,邱葭菲 陈小红 王伟春 林波 巫红燕 王瑞权 ,浙江机电职业技术学院,76
34,低资源场景下的对话系统任务的模型定制,宋伊萍 ,北京大学,72
34,大数据管理与挖掘,邵景峰 ,西安工程大学,70
34,Graph Representation Learning for Drug Discovery,史晨策 ,MILA,70
34,对神经网络对抗鲁棒性正则化的认识,温宇馨 ,华南理工大学,69
34,计算机组织与结构,赖晓晨 王洁 迟宗正 ,大连理工大学,67
34,度量和改进图信息在图神经网络中的使用,侯逸帆 ,香港中文大学,67
34,Brain Science and Advanced Imaging Techniques,张明 ,西安交通大学,66
34,Engineering Responsible AI,沈向洋 ,清华大学,64
35,不止于准确性：使用CheckList为NLP模型的进行行为测试,吴彤霜 ,华盛顿大学,59
35,Introduction of Artificial Intelligence,莫宏伟 ,哈尔滨工程大学,58
35,北京邮电大学人工智能能力认证证书项目（002期）,李蕾 杨亚 李睿凡 周延泉 袁宝库 ,北京邮电大学,57
35,细粒度实体分类综述,金海龙 ,清华大学,57
35,基于神经隐变量模型的对话状态推理,闵庆凯 ,南京航空航天大学,57
35,结合词典的中文命名实体识别,李孝男 ,复旦大学,55
35,Java Object Oriented Programming,单博炜 ,长安大学,54
35,TIMME: Twitter Ideology-detection via Multi-task Multi-relational Embedding,肖之屏 ,加州大学洛杉矶分校,53
35,神经机器翻译中的曝光偏差，幻觉翻译与跨域稳定性,王朝君 ,爱丁堡大学,47
35,智能技术与系统,,,47
36,WWW 2020 | 探索资源约束的Contextual Bandits问题,李卿阳 唐小程 ,学堂在线计算机学院,47
36,轮式机器人入门,索毅 ,学堂在线,40
36,MySQL Database Programming,付湘琼 赵晓侠 杜文方 郝熙 刘领兵 潘晟旻 郑发鸿 寇卫利 李菊芳 张春红 张俊 张霖 马晓静 ,昆明理工大学,38
36,多领域端到端任务型对话系统研究分享,覃立波 ,哈尔滨工业大学,34
36,零基础晋级高级UI设计师（2020）,,学堂在线,34
36,探究句法信息对于基于句法距离的语言模型影响,杜文宇 ,西湖大学,33
36,计算机辅助绘图——Solid Edge ST,李世芸 ,昆明理工大学,28
36,深度学习训练营（测试）,胡晓林 ,清华大学,19
36,Ship,孙建平 姜忻 ,大连海事大学,13
36,机器学习训练营第2期,张敏 ,学堂在线计算机学院,10
37,深度学习原理与PyTorch实战,张江 ,集智学园,9
37,自然语言处理训练营,刘知远 ,学堂在线计算机学院,8
37,推荐系统训练营（第2期）,张敏 ,学堂在线计算机学院,5
37,深度学习训练营,胡晓林 ,学堂在线计算机学院,5
37,南开大学信息安全微专业（002期）,,南开大学,3
37,青少年编程能力培养计划,郑莉 徐明星 邬晓钧 陈永强 ,清华大学,3
37,数据科学认证证书项目（2020年4期）,袁博 王智 袁春 何隽 何隽 ,清华大学,2
37,北京邮电大学人工智能能力认证证书项目（003期）,,北京邮电大学,2
