order,class_name,class_teacher,class_school,class_sum
1,C++语言程序设计基础,郑莉 李超 徐明星 ,清华大学,424289
1,数据结构(上),邓俊辉 ,清华大学,410931
1,数据结构（下）,邓俊辉 ,清华大学,358619
1,Java程序设计,郑莉 ,清华大学,195311
1,操作系统,向勇 陈渝 ,清华大学,193154
1,网络技术与应用,沈鑫剡 俞海英 李兴德 许继恒 钱万正 徐海斌 魏涛 宋以胜 ,中国人民解放军陆军工程大学,176093
1,C++语言程序设计进阶,郑莉 李超 徐明星 ,清华大学,117488
1,C程序设计案例教程（基础）,张莉 ,中国农业大学,113470
1,C程序设计案例教程（进阶）,张莉 ,中国农业大学,110285
1,数据挖掘：理论与算法,袁博 ,清华大学,108042
2,大数据技术与应用,李军 ,清华大学,97962
2,软件工程,刘强 刘璘 ,清华大学,93780
2,计算机文化基础,李秀 姚瑞霞 安颖莲 全成斌 ,清华大学,83726
2,程序设计基础,徐明星 王瑀屏 邬晓钧 ,清华大学,80808
2,组合数学,马昱春 ,清华大学,74409
2,大数据系统基础,王建民 徐葳 陈康 陈文光 ,清华大学,74255
2,VC++面向对象与可视化程序设计（上）：Windows编程基础,黄维通 ,清华大学,69325
2,VC++面向对象与可视化程序设计（下）：MFC编程基础,黄维通 ,清华大学,67928
2,人工智能原理,王文敏 ,北京大学,63829
2,大数据平台核心技术,武永卫 姚文辉 陶阳宇 冯骁 谢德军 ,清华大学,62980
3,大学计算机教程,张莉 马钦 ,中国农业大学,62262
3,Web前端攻城狮,刘强 吴亮 赵文博 ,清华大学,57718
3,Office办公软件应用,史巧硕 朱怀忠 刘洪普 李娟 ,河北工业大学,57565
3,汇编语言程序设计,张悠慧 翟季冬 ,清华大学,55244
3,计算机应用基础,宋承继 李莹 李龙龙 ,陕西工业职业技术学院,55146
3,微软亚洲研究院大数据系列讲座,洪小文 宋睿华 谢幸 郑宇 张洪宇 ,Microsoft,52838
3,算法设计与分析,王振波 ,清华大学,51363
3,学做小程序——基础篇,刘强 小程序慕课讲师 ,清华大学,51081
3,大学计算机——计算思维的视角,郝兴伟 ,山东大学,49773
3,面向对象程序设计（C++）,黄震春 徐明星 ,清华大学,49065
4,数据科学导论,袁博 何隽 ,清华大学,48678
4,大学计算机基础,卫春芳 ,湖北大学,46976
4,基于Linux的C++,乔林 ,清华大学,45908
4,大学计算机基础,徐红云 刘欣欣 曹晓叶 ,华南理工大学,45126
4,计算机网络,袁华 杜广龙 张凌 ,华南理工大学,44658
4,JAVA程序设计进阶,许斌 ,清华大学,42077
4,Web开发技术,陈静 王成良 祝伟华 ,重庆大学,38323
4,计算几何,邓俊辉 ,清华大学,38159
4,程序设计基础（上）,赵宏 闫晓玉 李妍 王恺 李敏 ,南开大学,36497
4,大数据机器学习,袁春 ,清华大学,35763
5,R语言数据分析,艾新波 ,北京邮电大学,35546
5,ARM微控制器与嵌入式系统,曾鸣 薛涛 龚光华 ,清华大学,35465
5,单片机原理及应用,杨居义 王颖丽 蒲敏 向兵 ,绵阳职业技术学院,34780
5,程序设计基础（下）,赵宏 李妍 闫晓玉 王恺 李敏 ,南开大学,32428
5,高级大数据系统,王智 ,清华大学,31644
5,Python程序设计基础,许志良 ,深圳信息职业技术学院,31342
5,大学计算机基础,李敏 高裴裴 郭蕴 赵宏 刘哲理 路明晓 李妍 闫晓玉 宋丽培 ,南开大学,30529
5,移动快速应用开发,唐贤传 盛鸿宇 王婷婷 汤恒 胡万福 ,芜湖职业技术学院,27497
5,数据库技术与程序设计,高裴裴 李敏 袁晓洁 赵宏 路明晓 康介恢 闫晓玉 李妍 郭蕴 ,南开大学,26979
5,人工智能,罗会兰 ,江西理工大学,26875
6,Linux 内核分析与应用,陈莉君 谢宝友 张天飞 王小银 刘霞林 张丽丽 ,西安邮电大学,26071
6,科学计算与MATLAB语言,刘卫国 蔡旭晖 吕格莉 何小贤 ,中南大学,25369
6,网络安全概述,纪平 ,学堂在线,24977
6,区块链和加密数字货币,罗玫 ,清华大学,24851
6,互联网大规模数据分析技术,李琳 张蕊 ,武汉理工大学,24694
6,大学物理,侯岩雪 张素红 赵原源 李子敬 王晓颖 王明利 韩振丽 丁喜峰 ,燕山大学,24232
6,Foundations of Computer Graphics,Ravi Ramamoorthi ,加州大学伯克利分校,23610
6,C语言程序设计（上）,李凤霞 陈宇峰 赵三元 ,北京理工大学,23237
6,C君带你玩编程,方娇莉 潘晟旻 普运伟 耿植林 郭玲 田春瑾 刘领兵 黎志 杜文方 郑明雄 ,昆明理工大学,22950
6,数据库系统（上）：模型与语言,战德臣 ,哈尔滨工业大学,22923
7,计算机操作系统,骆斌 葛季栋 ,南京大学,21483
7,Android应用开发基础,赖红 李钦 李华忠 ,深圳信息职业技术学院,21411
7,程序设计基础,吴劲 傅翀 吴佳 罗绪成 王瑞锦 张翔 张学 程红蓉 白忠建 陈伟 江春华 ,电子科技大学,20681
7,微机原理与接口技术,吴宁 ,西安交通大学,20557
7,软件理论基础,罗贵明 ,清华大学,19975
7,小波与科学,冉启文 严质彬 肖宇 张海莹 杨占文 李莉 ,哈尔滨工业大学,19632
7,大数据治理与政策,孟庆国 张楠 郑磊 ,清华大学,19229
7,智能车制作：嵌入式系统,曾鸣 ,清华大学,18936
7,智能车制作：电子技术,任艳频 ,清华大学,18213
7,C语言程序设计基础,李丹 耿植 杨琼 高腾刚 ,贵州理工学院,18055
8,学做小程序——实战篇：树洞小程序,刘强 施建锋 伊甸 小程序慕课讲师 ,清华大学,17986
8,数据结构与算法设计,张小艳 史晓楠 李占利 丁雪芳 冀汶莉 王昱哲 齐爱玲 杨晓强 ,西安科技大学,17981
8,计算机文化基础,杨居义 ,绵阳职业技术学院,17890
8,小白学人工智能,李粤 ,华南理工大学,17826
8,编译技术,王曙燕 初建玮 王春梅 陈燕 黄茹 曾艳 ,西安邮电大学,17625
8,软件设计模式,朱洪军 ,中国科学技术大学,17078
8,移动互联网开发,朱轶 ,江苏大学,16700
8,数据结构（Data Structures）,吕建明 张见威 肖南峰 ,华南理工大学,16552
8,SQL SERVER数据库技术,刘引涛 戚娜 李俊 任婕 ,陕西工业职业技术学院,16414
8,高级数据库系统,杜金莲 ,北京工业大学,16090
9,软件测试,郑炜 黄松 倪爱军 刘中 于婷婷 吴潇雪 ,西北工业大学,15932
9,C语言程序设计,丁海燕 胡盛 ,云南大学,15826
9,大学计算机,李凤霞 陈宇峰 赵三元 ,北京理工大学,15744
9,计算机通信网络,卢选民 闫中江 赵宏伟 ,西北工业大学,15492
9,物联网工程导论,普园媛 何乐生 余鹏飞 杨艳华 艾昌文 尉洪 常俊 周永录 刘宏杰 ,云南大学,14986
9,Java程序设计基础,赖红 李钦 覃国蓉 魏勇 ,深圳信息职业技术学院,14813
9,Petri网：模型、理论与应用,袁崇义 闻立杰 王建民 ,清华大学,14522
9,Linux系统管理,颜晨阳 ,宁波城市职业技术学院,14211
9,微软--计算机视觉论文分享课,,,12997
9,网络、群体与市场,石兵 ,武汉理工大学,12824
10,大数据算法,王宏志 ,哈尔滨工业大学,12815
10,玩转计算机二级—office高级修炼,苟燕 王强 刘志国 侯欣舒 ,内蒙古师范大学,12505
10,嵌入式系统设计,杨峰 ,电子科技大学,12491
10,数据库系统（中）：建模与设计,战德臣 ,哈尔滨工业大学,12032
10,信息安全技术,孙建国 赵国冬 兰海燕 ,哈尔滨工程大学,11947
10,数据库系统原理与开发,陆鑫 张凤荔 陈安龙 ,电子科技大学,11619
10,数据库系统（下）：管理与技术,战德臣 ,哈尔滨工业大学,11466
10,大学物理（力学）,孟庆鑫 韩权 ,哈尔滨工业大学,11357
10,C语言程序设计（下）,李凤霞 陈宇峰 薛庆 赵三元 ,北京理工大学,11229
10,深度学习基础,刘远超 ,哈尔滨工业大学,11187
11,程序设计基础,叶麟 苏小红 赵玲玲 ,哈尔滨工业大学,11026
11,软件工程与软件自动化,高玉金 王一拙 ,北京理工大学,10954
11,高级操作系统,陈渝 ,清华大学,10940
11,计算机程序设计基础,乔林 ,清华大学,10807
11,软件工程,张爽 ,东北大学,10648
11,大学计算机基础与应用,李丽芬 邵芬红 韩海花 陈晓芳 ,燕京理工学院,10637
11,Linux操作系统分析,孟宁 ,中国科学技术大学,10597
11,Python大数据分析,崔立真 鹿旭东 潘鹏 ,山东大学,10493
11,计算机网络 Computer Networks,王昊翔 ,华南理工大学,10465
11,Linux导论,杰里•库伯斯坦 ,学堂在线,10347
12,信息素养-互联网+时代的学习与生活,陈桂林 赵生慧 于春燕 张志勇 徐志红 胡晓静 ,滁州学院,10226
12,计算机控制导论,李东升 ,山东大学,10195
12,计算机绘图与CAD,张鹏 ,大连工业大学,10096
12,信息隐藏技术,任帅 ,长安大学,9674
12,北大AI公开课,雷鸣 ,北京大学,9673
12,This is AI,IBM Research ,学堂在线,9592
12,智能设备应用开发（基于Android平台）,贾连芹 周倩 王军 徐红 ,山东商业职业技术学院,9367
12,计算机绘图,涂晶洁 ,宁波大红鹰学院,9355
12,计算机程序设计,周会平 ,国防科技大学,9282
12,Python语言程序设计,杨洁 曲著伟 李在伟 周家地 卢永江 应芳琴 廖一星 刘毅 张铭 ,浙江财经大学东方学院,8595
13,5G与人工智能,胡白燕 王润 ,湖北师范大学,8570
13,设计思维,刘静伟 孟浏今 厉谦 吴龙 薛媛 ,西安工程大学,8480
13,程序设计语言（C语言）,李岚 ,湖北职业技术学院,8171
13,Python爬虫入门实战,饶淙元 ,清华大学,8150
13,高性能计算机网络,颜昕 ,武汉理工大学,8064
13,数据挖掘,喻梅 王建荣 于健 徐天一 赵满坤 高洁 刘志强 ,天津大学,7965
13,媒体大数据挖掘与案例实战,沈浩 ,中国传媒大学,7686
13,计算机基础与应用,李春宏 徐娟 沙莉 玄文启 沈湘芸 何锋 ,云南财经大学,7654
13,计算机组成原理,纪禄平 ,电子科技大学,7573
13,微电子工艺,田丽 王蔚 ,哈尔滨工业大学,7521
14,计算思维导论,唐培和 徐奕奕 ,广西科技大学,6953
14,嵌入式系统理论与技术,胡威 施青松 ,武汉科技大学,6369
14,万物互联,杜秀娟 ,青海师范大学,6265
14,计算思维导论,吕橙 万珊珊 邱李华 郭志强 ,北京建筑大学,6258
14,嵌入式系统,毕盛 汪秀敏 毛爱华 唐杰 ,华南理工大学,6055
14,游戏程序设计,徐力 钟建斌 高璐 孙峻 王毅 兰翔 马若遥 王海龙 乔晨 黄健聪 陈志浩 周轩 赖贵雄 林智超 潘霖 晁阳 唐声福 曾毅 刘洋 陈明建 李波 祝清鲁 赵永伟 肖坚 ,清华大学,6032
14,Web设计与应用,潘晟旻 方娇莉 姜迪 郭玲 普运伟 陈榕 张春红 刘领兵 田春瑾 耿植林 黎志 ,昆明理工大学,5938
14,计算机辅助设计,方利国 ,华南理工大学,5926
14,“做中学”Java程序设计,郑哲 ,宁波城市职业技术学院,5854
14,液晶显示技术,王丹 姚日晖 郑奕娜 ,华南理工大学,5479
15,多媒体技术,李晶 涂卫平 常军 陈江汉 韩镇 ,武汉大学,5461
15,操作系统原理,田丽华 ,西安交通大学,5352
15,青年AI自强计划-计算机视觉课程,王明哲 ,清华大学,5302
15,单片机原理及应用,李璋 田茂 姚静 黄汉华 ,湖北大学,5094
15,互联网体系结构,孟宁 刘贵学 ,中国科学技术大学,4847
15,物联网概论,何源 ,清华大学,4838
15,网络技术与应用实验,俞海英 沈鑫剡 李兴德 许继恒 李杰 张石磊 谢青 ,中国人民解放军陆军工程大学,4808
15,智能车制作：底盘结构与调试,杨珏 ,北京科技大学,4731
15,软件工程,张晓龙 刘茂福 赵红武 王磊 高峰 ,武汉科技大学,4680
15,漏洞利用及渗透测试基础,刘哲理 张健 李敏 李兴娟 乜鹏 ,南开大学,4625
16,素描与体验——原理与形式研究,张元稼 刘沛 杨伟孝 董文通 胡涛 李恺 ,西安美术学院,4473
16,操作系统,张伟 ,东北大学,4387
16,Web安全实践,郭燕 ,中国科学技术大学,4332
16,EXCEL高级应用,王瑾瑜 索丽霞 陈一 吴淑清 王晓静 ,呼和浩特职业学院,4240
16,程序设计技术（基于C）-基础,刘慧君 王茜 陈恒鑫 葛亮 曾令秋 杨瑞龙 ,重庆大学,4076
16,智能控制导论,刘辉 王彬 李俊丽 詹跃东 ,昆明理工大学,3987
16,智能控制,黄从智 ,华北电力大学,3814
16,大数据可视化,陈为 巫英才 ,浙江大学,3743
16,操作系统(RISC-V),向勇 陈渝 ,清华大学,3339
16,高级语言程序设计,祁文青 程细才 谢晋 ,湖北理工学院,3310
17,虚拟现实技术及应用,黄心渊 杨刚 孙国玉 李晓波 陈京炜 ,中国传媒大学,2987
17,计算机网络,郑瑞娟 王琳 肖春宝 张明川 吴庆涛 朱军龙 ,河南科技大学,2967
17,单片机原理及应用,鲍佳 ,浙江理工大学,2922
17,3D游戏引擎架构设计基础,陈泽琳 ,华南理工大学,2880
17,计算方法,张晓丹 郑连存 卫宏儒 沈政伟 丁军 ,北京科技大学,2684
17,跟着案例循序渐进学习c,白妙青 王雪婴 张红艳 萧宝玮 王文剑 ,山西大学,2670
17,数据结构,胡平 ,安徽工程大学,2627
17,概率论与数理统计,马占友 吕胜利 马金旺 王春艳 张彦 ,燕山大学,2616
17,多媒体技术及应用,郭芬 林育蓓 陆芳 ,华南理工大学,2603
17,网络安全技术(上海高校精品课程),贾铁军 ,学堂在线,2401
18,PHP程序设计,耿倩 党佳奇 雒江川 李俊 赵革委 蔡苏亚 ,陕西工业职业技术学院,2199
18,Code+程序设计大赛习题讲解,清华酒井算协 ,学堂在线,2133
18,数据库技术应用,赵祯 刘刚 孙凤龙 田雪 ,内蒙古电子信息职业技术学院,2030
18,数据结构与算法,吕威 苏清朗 冯广慧 陈群 马蕊 曾志平 ,吉林大学珠海学院,2005
18,计算机是如何实现智能的,马少平 ,清华大学,1787
18,疾风计划2021【一年时间助你学通计算机专业】,郑莉 邓俊辉 李超 徐明星 王瑀屏 邬晓钧 黄震春 刘强 刘璘 王振波 向勇 陈渝 纪禄平 陈志刚 陆鑫 张凤荔 陈安龙 袁华 杜广龙 张凌 陈琼 马千里 陈伟能 胡劲松 ,清华大学,1782
18,网页设计与地图应用,李中元 梅新 杜晓初 成晓强 ,湖北大学,1758
18,Python 交互式程序设计导论,张太红 ,新疆农业大学,1626
18,网络安全技术,张玉 ,南开大学,1592
18,网络安全,曹家浩 郭润 ,清华大学,1453
19,程序设计技术(基于C)-提高与应用,刘慧君 王茜 陈恒鑫 葛亮 曾令秋 杨瑞龙 ,重庆大学,1418
19,数据结构与算法,刘馨月 于红 张淼 ,大连理工大学,1400
19,计算未来云讲坛（2020）——清华大学计算机系前沿系列讲座,刘知远 易鑫 ,清华大学,1379
19,数据科学：一种新的思维方式,袁博 ,清华大学,1307
19,软件测试与质量保证,周勇 朴勇 ,大连理工大学,1289
19,系统辨识,刘翠玲 赵峙尧 ,北京工商大学,1236
19,数据结构,杨春花 刘国玲 李爱民 单建芳 ,齐鲁工业大学,1225
19,计算机音乐,李荣锋 ,北京邮电大学,1184
19,全球股市下跌-加密数字货币是避险资产吗？,罗玫 ,清华大学,1179
19,数据库概论,张璇 包崇明 蔡莉 ,云南大学,1156
20,疫情防控，大数据分析大显身手,李国良 ,清华大学,1136
20,网络安全攻防入门：漏洞利用及渗透测试基础,刘哲理 ,南开大学,1125
20,计算机辅助飞行器综合设计,袁昌盛 ,西北工业大学,1113
20,计算机网络,侯睿 李艳红 毛腾跃 周斌 王飚 朱剑林 ,中南民族大学,1112
20,从感知智能到认知智能：深度学习再思考,邓志东 ,清华大学,1081
20,喜迎清华大学109周年校庆-软件学院系列线上活动,杜平 尉迟坚 王建民 ,国家发展与改革委员会,1047
20,闲话AI：自然语言理解难在那儿？,刘知远 ,清华大学,978
20,贵系特奖学霸：科研小白入门指北,高天宇 ,清华大学,934
20,个人计算机主要硬件介绍,朱书琦 ,清华大学,905
20,王者荣耀荆轲之模型到游戏开发,于野 张永锋 ,启迪阿加学院,885
21,C语言程序设计,赵楷 任疆红 孙晶 盛琪 曹为民 周鲁梅 楚发元 张振宇 ,新疆大学,875
21,AutoCAD软件应用,徐秀娟 孙路 霍奕宇 ,陕西国防工业职业技术学院,825
21,C语言程序设计,刘进锋 ,宁夏大学,825
21,C程序设计,姜学锋 刘君瑞 ,西北工业大学,775
21,C#程序设计,刘君瑞 姜学锋 ,西北工业大学,708
21,清华大数据应用实践：快速搭建基于数据的应用,刘英博 ,清华大学,695
21,安卓手机软件拼图式开发App   Inventor,王杰 ,广东开放大学,669
21,视觉无障碍智能交互,史元春 ,清华大学,666
21,大学计算机基础（艺术类）,史家银 杜文博 朱原良 ,云南艺术学院,631
21,不确定性时代的计算传播学研究,王成军 张伦 许小可 ,南京大学,631
22,Compilation Principle,刘刚 付岩 曹雪 李丽洁 高迪 ,哈尔滨工程大学,571
22,计算机病毒分析,王志 ,南开大学,526
22,人工智能,陈钒 ,天津财经大学,519
22,编译技术,徐秀娟 贾棋 任志磊 江贺 刘馨月 ,大连理工大学,516
22,C++程序设计,魏英 姜学锋 ,西北工业大学,508
22,理论和实践：自然语言处理,,,506
22,2020年中国科技峰会系列活动青年科学家沙龙,,,480
22,计算机系统架构的新挑战,汪东升 ,清华大学,461
22,复杂场景下的知识获取,韩旭 ,清华大学,449
22,用新数学做数据库,蒋步星 ,润乾软件,440
23,毕业季博硕论坛,刘知远 潘欣 丁小可 梁鼎 张国鑫 张凯 叶明江 林会杰 曹曦 涂存超 杨植麟 庞海天 武彬 ,清华大学,425
23,智能运维,汤汝鸣 孟伟彬 苏亚 刘平 ,清华大学,409
23,工业互联网大讲堂,田野 严鹏飞 ,中国工业互联网研究院,403
23,机器人的主动感知与行为学习,孙富春 ,清华大学,396
23,深度迁移学习在NLP当中的应用和实践,苏海波 ,学堂在线,376
23,数据到决策的框架：三个机器学习任务、三次结构转换,蒋朦 ,美国圣母大学,372
23,自动驾驶汽车电子控制系统工程师训练营,成波 ,学堂在线,361
23,Access程序设计基础,梁洁 张泽华 崔燕妮 林玲 ,云南大学,360
23,2020KDD顶会论文分享,任慧敏 李昂 晋嘉睿 窦英通 高峻逸 林禹臣 马辰 ,美国伍斯特理工学院,357
23,深度学习在推荐系统中的应用与发展,王喆 ,清华大学,350
24,2020年公派出国留学政策及项目,国家留学基金委 ,清华大学,349
24,C Programming,汪芳 张秀伟 周果清 刘君瑞 魏英 姜学锋 ,西北工业大学,341
24,推荐系统中的用户理解：偏好、意图、行为与满意度,张敏 ,清华大学,331
24,量子计算离我们还远吗？,应明生 孙晓明 马雄峰 段润尧 ,清华大学,317
24,清华大学之“贵系”万花筒,刘潇 杨宗瀚 李晓涵 吴之璟 陈晟祺 高天宇 ,清华大学,316
24,南开大学信息安全微专业发布会,,,316
24,Code+程序设计大赛颁奖典礼,,,314
24,疫情与5G,孙松林 ,北京邮电大学,313
24,快手商业用户体验Insight,高小平 ,清华大学,310
24,论道AI Open,,,308
25,高级机器学习训练营,唐杰 ,学堂在线,304
25,文献检索与论文写作,武祥龙 ,西北工业大学,290
25,算法支撑的赛博智能经济,徐恪 ,清华大学,287
25,“神威·太湖之光”超级计算机优化方法与应用简介,甘霖 ,清华大学,286
25,Database Technology and Programming,高裴裴 李敏 袁晓洁 赵远红 康介恢 ,南开大学,281
25,知识驱动：人才战略的未来,张鹏 ,清华大学,279
25,国际超算赛事称霸指南,何家傲 陈晟祺 ,清华大学,277
25,AI肖像画大师：生成对抗网络驱动的多风格艺术肖像画创作,刘永进 ,清华大学,277
25,计算机组成原理与系统结构,李晨 ,西安交通大学,277
25,浅谈面试中的算法题,杨耀良 谢兴宇 ,清华大学,273
26,The 2nd TBSI Workshop on Learning Theory,,,268
26,走向以人为本的人工智能：利用人工智能提高人类决策能力,谭宸浩 ,科罗拉多大学波尔得分校,266
26,网络安全博弈之路,张超 ,清华大学,265
26,为网络化系统设计智能可靠的优化算法,黄隆波 ,清华大学,259
26,推荐系统产品分享,叶妃霞 ,学堂在线计算机学院,259
26,ICACHI 云论坛系列,任向实 付志勇 王建民 麻晓娟 袁晓君 李维 涂华伟 黄大源 杨兴栋 付志勇 Peter Scupelli 张黎 ,日本高知工科大学,256
26,计算机视觉,鲁鹏 ,北京邮电大学,250
26,当微信邂逅NLP基础研究,李鹏 ,清华大学,249
26,低时延网络挑战赛：从5G和边缘计算到互联网,崔勇 ,清华大学,247
26,基于数据驱动的网络技术应用,姜泽勋 焦立博 董加卿 ,清华大学,244
27,教AI审合同——人工智能技术在法律领域的应用,张天扬 ,清华大学,241
27,知识疫图——AI+大数据在新冠肺炎知识智能服务中的应用,张鹏 ,智谱·AI,237
27,AI for Academic Search （人工智能助力学术搜索）,唐杰 周园春 李涓子 刘筱敏  刘雪峰 杜一 张鹏 ,清华大学,230
27,基于神经网络建模的信息传播预测,杨成 ,清华大学,225
27,新冠疫情地图可视化的技术实践,殷达 ,清华大学,225
27,计算机网络技术,巩向锋 王亚晨 张楚文 万颖 郭润 张一铭 江逸敏 林耘森箫 王子逸 ,旷视科技有限公司,219
27,机器阅读理解：算法与实践,朱晨光 ,微软,214
27,用户导向的音视频体验优化,马茗 ,清华大学,211
27,法律智能,钟皓曦 ,清华大学,210
27,金融科技与量化分析,孟康健 刘英斐 汪浩 宋战江 ,学堂在线,207
28,算法训练营,邓俊辉 ,清华大学,204
28,基于图神经网络的事实验证,周界 ,清华大学,204
28,深度学习框架的移动端优化,曾平 杨滔 ,旷视科技有限公司,203
28,面向移动与边缘设备的人工智能系统,徐梦炜 ,北京大学,197
28,程序设计,李自力 ,西南财经大学,192
28,C Programming,丁海燕 胡盛 ,云南大学,189
28,Software Engineering,张爽 ,东北大学,189
28,计算机图形学,孙劲光 ,辽宁工程技术大学,188
28,人工智能基础核心技术之事件检测,仝美涵 ,清华大学,184
28,知识图谱推理问答综述,史佳欣 ,清华大学,181
29,知识图谱推理问答综述,史佳欣 ,清华大学,181
29,对话系统：过去、现在和未来,黄民烈 ,清华大学,178
29,Web前端开发,何杰惠 孙瑜 苟彦昉 ,陕西国防工业职业技术学院,175
29,解密旷视抗疫情AI体温产品——明骥,胡晨 ,清华大学,173
29,面向对象分析与设计,张涛 ,西北工业大学,173
29,Computer Networks,王昊翔 ,华南理工大学,170
29,清华大学计算机系1996级创新创业论坛,,,165
29,融合知识的预训练语言模型,张正彦 ,清华大学,165
29,HTML5 Mobile Front-end Development Foundation,刘小华 曾建华 ,深圳职业技术学院,165
29,商汤泰坦公开课模型量化专题,余锋伟 龚睿昊 ,商汤科技,156
30,滴滴语音技术,滴滴-科技生态与发展部 ,滴滴,156
30,Introduction to C++: Problem Solving Using Computational Thinking,赵宏 郭蕴 路明晓 李妍 王刚 郭天勇 于刚 康介恢 ,南开大学,155
30,复杂场景下的机器阅读理解,林衍凯 ,清华大学,155
30,数据结构与算法,黄晓鸣 ,北京交通大学,151
30,时空大数据分析和挖掘实战,袁海涛 ,清华大学,150
30,EMNLP2020专场分享,李健铨 关健 朱子宁 ,天津大学,150
30,初探图神经网络在分子成药性估计中的应用,裘捷中 ,清华大学,147
30,Computer Fundamentals: Problem Solving Using Computational Think,李敏 高裴裴 郭蕴 蔡庆琼 宋丽培 ,南开大学,145
30,从入门到大神：疫情知识智能服务核心技术实践,张鹏 曾奥涵 叶子逸 殷达 杜冀中 ,智谱·AI,145
30,网络测量与管理,周禹 郑智隆 王海博 ,清华大学,142
31,“数据赋能”推动产业转型升级,王建民 刘江川 顾维玺 田春华 王轶捷 ,清华大学,137
31,大规模在线教育中的知识智能,于济凡 ,清华大学,134
31,非易失内存在分布式存储领域的应用,张凯 ,清华大学,132
31,2020高校人工智能人才培养论坛,,,130
31,联邦智能和基于隐私保护的分布式机器学习,蔡超超 王昊昱 ,数牍科技,128
31,工业级推荐系统的特点与挑战,张亚峰 ,学堂在线计算机学院,123
31,表示学习的利与弊,赵晗 ,伊利诺伊大学香槟分校,121
31,Introduction to Artificial Intelligence,王刚 李妍 康介恢 王恺 ,南开大学,117
31,NLP应用中Transformer模型线上服务加速的业界实践,方佳瑞 ,清华大学,116
31,VR Experience and Panoramic Video Creation,冯欢 ,南开大学,115
32,"CVPR2020""最佳论文""对cv领域的启发",黄高 ,清华大学,114
32,C++编程训练营,郑莉 李超 徐明星 ,学堂在线,113
32,在线教学网络研讨会会议精彩回放,张莉 赵宏 郑莉 ,中国农业大学,112
32,从梯度信噪比来理解深度学习泛化性能为什么这么好,刘锦龙 ,清华大学,111
32,利用轨迹数据自动校准道路交叉口拓扑信息,刘国平 ,学堂在线计算机学院,111
32,智谱新冠流行预测大赛线上颁奖&AI TIME 线上分享,李涓子 刘德兵 张鹏 ,清华大学,110
32,自动化测试及修复神经网络翻译模型,孙泽宇 ,北京大学,110
32,疫情影响下求职的挑战与机遇,张杰 ,学堂在线,109
32,Computer-Aided Drug Design,孙平华 丁克 王玉强 陆小云 徐俊 ,暨南大学,106
32,基于搜索日志、多维度信息的新冠肺炎风险预测,叶子逸 曾奥涵 ,清华大学,104
33,任务导向型对话系统评测,高信龙一 ,清华大学,102
33,自监督学习在视觉场景中的研究新进展,詹晓航 李顺恺 ,香港中文大学,102
33,KdConv: 知识驱动的中文多轮对话数据集,郑楚杰 ,清华大学,98
33,MixText: Linguistically-Informed Interpolation of Hidden Space for Semi-Supervised Text Classification,陈佳奥 ,佐治亚理工学院,91
